{
  "schemaVersion": "1.0",
  "source": { "system": "example-saas", "integrationId": "7d1f6a0e-3c4b-4f8a-9b2e-5a6c7d8e9f01" },
  "customer": { "externalRef": { "type": "external_user_id", "id": "usr_48213" }, "accountStatus": "active" },
  "subscription": {
    "status": "active",
    "plan": { "key": "pro_monthly", "name": "Pro" },
    "startedAt": "2026-03-02T10:00:00Z",
    "currentPeriodStart": "2026-10-02T10:00:00Z",
    "currentPeriodEnd": "2026-11-02T10:00:00Z",
    "trialEndsAt": null,
    "cancellation": { "state": "none", "requestedAt": null, "effectiveAt": null }
  },
  "entitlements": [
    { "key": "exports.pdf", "label": "PDF export", "state": "granted", "source": "plan", "reason": null, "expiresAt": null },
    { "key": "team.members", "label": "Team members", "state": "granted", "source": "addon", "reason": null, "expiresAt": "2026-11-02T10:00:00Z" }
  ],
  "usage": [
    { "key": "ai.credits", "label": "AI credits", "unit": "credits", "period": "billing_period", "limit": 500, "used": 120, "remaining": 380, "unlimited": false, "resetsAt": "2026-11-02T10:00:00Z" }
  ],
  "freshness": {
    "generatedAt": "2026-10-21T09:15:00.412Z",
    "dataAsOf": "2026-10-21T09:14:58Z",
    "maxAgeSeconds": 60,
    "availability": { "subscription": "available", "entitlements": "available", "usage": "available" }
  }
}
